title,score,url,num_comments,created_utc,selftext,comments
What is everybody’s feelings on the new AI DJ,13,https://www.reddit.com/r/spotify/comments/14fwpbg/what_is_everybodys_feelings_on_the_new_ai_dj/,59,1687419191.0,,"['It\'s ok, I drive for work so it\'s the best option I have so I don\'t have to mess with the phone.. whenever he says ""songs our editors picked"" I start skipping tracks till ""up next"". He does get fixated on some things I listened to infrequently and says it\'s one of my top artists. Sometimes he gets in a loop. Sometimes he butchers the names of artists and it gives me a laugh. I think in the 2 months I\'ve been using it there\'s been 2 or 3 songs that I really really like and hadn\'t heard before.', ""I don't think it knows what I want to listen to\n\n\nAnd tbh I wish he was more descriptive on what the collection of songs he's about to play. Bc sometimes it'll start playing something I don't know and I won't know if it's what I want."", ""Is fairly shit? Used it a couple of times when it was introduced, haven't been back to it the last couple of weeks."", 'I’d rather just be able to listen to normal radio on Spotify?', 'I really like it!\n\nI only get the DJ voice on the mobile version and not on desktop.  Does anyone else have the same issue?  Know how to get it on for Desktop?', 'It’s decent it definitely plays off of what you’re listening to from certain periods so I’m confused why people say it plays bad music, it just plays what you listen to', 'I actually really like it, feels like a real radio station it’s pretty cool', 'A garbage feature no one asked for', 'Damn this is fresh and the voice is good. First song it picked for me is Land Of The Snakes 🔥 \n\nEvery time I click the AI button bottom right does it change the station type / name?', ""I feel like there's nothing intelligent about it. All it does is just play your random autogenerated playlists that you can get to yourself anyway. It's just got a button to choose another random playlist."", ""Just cancelled Spotify because I clicked on AI DJ by mistake and now they say it's compulsory. I was premium and I should be able to choose what features I do or do not want on my dashboard. Was deep in focus, coding, getting somewhere when I'm interrupted by this tacky patter, I think it's pretty low-end so when I realized you can't remove it once enabled, i cancelled immediately."", 'I’m late to this thread but it is literally purely advertisement. It plays songs you haven’t listened to and recommends them. (Not to say I don’t like listening to new songs)\nIt is a different form of advertisement and most people are naive to it.\n\nI tried it and ended up turning it back onto my shuffle that didn’t have annoying “ads” \n\nWe should be able to tell it what kind of mood we are in (not have it guess.)', 'Plays shite', 'Wish it was available in Australia', ""Reviving the old comment because I was about to say something about this.  I was liking the DJ at first but now that it's been out for a while, it sure repeats itsself A LOT. Whether it's saying the exact same thing or repeating the exact same section of songs.  I wish it updated to more/newer stuff more often.  Also I noticed that none of the songs it plays ever show up in recently played to make an effect on recommendations.  So since that's all I've been using for the past couple weeks, it's not really updating with new stuff based on what I've been listentin gto."", ""I still don't have it"", 'I love it every song it has given me is a vibe', 'Ive enjoyed it for the most part. Been using it for a few weeks now and have already found alot of new songs I enjoy. Definitely not perfect, would like to see them continue to improve it.', ""Tried it today for the first time and was thoroughly underwhelmed. The random playlists Spotify generated were way more accurate for me.\n\nI'm fine with it suggesting new music or artists I've never heard of, but ffs at least be semi-related to my musical tastes."", 'i just got it finally, bro lowkey sound like donald trump sometime tho tell me i’m wrong 😂', ""I just got access yesterday and i'm loving it. I've never liked their shuffle algo because it always seems to play the same songs and I listen to my playlists so much they get boring. This AI has my taste nailed and I like that it plays in chunks like a few hip hop then a group of metal rather than a blend like shuffle."", 'We’re on a first name basis and starting a band.', ""There doesn't seem to be anything new about it. It sounds like the algorithm it uses for choosing music is the same exact one used for playing music after your queue runs out or any other time spotify is suggesting music to you. It's just following the trend of needlessly personifying existing features and presenting them as new."", ""I absolutely love the fact that it helps me revisit old favorites from the past. I'm talking 5,6 years back. Songs that I listened to on loop."", 'i hate it with a passion', 'Just tried it... he went from Bachata to 80s rock and then modern... it was solid mix... wow', 'There’s no AI engine behind it surely, it’s rubbish!\n\nInitially was super impressed, playing various current favourites, some old favourites, and some new discoveries ….\n\n…. but then starts playing absolute random highly popular stuff like Queen, Celine Dione, Meat loaf, Eagles, pub classics which are an absolute million miles away from the kind of music I listen too. So far away, that it’s laughable.\n\nI hit the skip button as quick as I possibly could, but it then tries to play them again to me the following day!\n\nIt’s not AI, it’s just a random engine that tries anything to see if it sticks. Rubbish.\n\nBack to daily mixes, which are far more intelligent. Would be nice to throw in some old favourites though.', 'why cant a fucking delete it urhjhnfghk', 'you dont have to skip every song until he does up next, you just click the dj button again, on the bottom right if the ""now playing"" is pulled up. works great, because yes it seems like half the time its just randomly guessing what type of songs you wanna listen to. which is fine in the beginning, i expect itll learn somewhere down the road', '[deleted]', ""Check out the My Tuner Pro app.  It's a reasonable one time purchase for radio from all over the world."", ""I have it on Desktop (US, WIndows 11).  No idea who the voice is supposed to be, but it's OK. Selection is actually pretty decent. Not as good as Pandora (nothing is, in my experience) but getting closer."", 'I mainly listen to shit music,  and now the dj only plays shit music.\n\n/s', ""Mine has been playing a bunch of random shit I've never listened to so idk about that"", ""Fr I'm surprised lol, discovered the feature today and it's pretty good, I also like the transition from one song to the next (I know it's an old feature, I just never activated it for Spotify)"", 'First of all, you don’t need to care. You don’t have to use it if you don’t want to. Second, it’s in beta, so if it’s garbage, it’s because it’s still in development.', ""It's in Australia now"", 'Probably will be soon.  Seems to have just come out in Canada.', 'Yeah, it does a good job of reminding you of old jams you used to listen to and introducing you to new stuff. I think the driving factor for me is that it switches it up, like you said. I often find myself often wanting to switch the music genre and my playlists have become predictable.', 'That’s right. You gotta listen to dudes talking about sexual acts.', 'Oooh looks more userfriendly and tidy than radio garden app (its free and it shows the globe)', 'I have access to radio, it’s just that if Spotify want to do this kind of thing it would make more sense for it to be real radio. And integration would improve recommendations', 'Huh that’s strange. Mine legit just plays sections of my likes songs. Even the “discover” parts are always songs I already have liked. Maybe mine is janky', ""I mean I just discovered it for the first time today and I'm quite enjoying it. The songs it suggests actually seem to be up my alley and I find myself adding them to a lot of playlist or even downloading albums. These comments are all from a few months ago so maybe it's been improved? Idk, I like it."", 'You are a legend! I’ve given you a reward from the alt account that has heaps of gold. Enjoy', 'but wasnt it rolled out like months ago at the end of feb?', 'Haha 60 days later and mine seems fairly curated to my taste. I’ve added songs to my actual playlist from the Dj which prompted me to look up others reaction…. Apparently not good', ""I just got a notification for it on both of my devices a few days ago.  And now it's an option on the home screen where Release Radar and stuff are. \n\nWeird.  After I made that comment I saw mention of it being released in Canada and USA first, but maybe Canada was behind?\n\nEdit:  just saw that it rolled out to 90% of Canada and USA in February.   I'm in Saskatchewan,  so maybe we got left out in the other 10%?"", 'I am enjoying the feature as well. The ai seems to be getting a lot better at finding music I like!']"
"Anyone else getting weird recommendations from spotify's new ""AI DJ""",83,https://www.reddit.com/r/spotify/comments/14rtoum/anyone_else_getting_weird_recommendations_from/,40,1688606512.0,"I opened up spotify to see a new thing called an AI DJ. figured why not try it out and let it run for an few hours while I worked. First impressions are they need to make it stop talking while songs are starting. bands with a long name get spoken over the start of songs. Also the music its playing is just the songs from my playlist grouped into either all the same band or added to what it calls genres. It will tell you here is some blues it will think you'll like and it starts playing johnny cash, then some ""old country songs"" and a johnny cash song from the same album is played, finally it says. heres some folk songs, and it plays johnny cash hurt. 

It will say ""heres a few songs from an artist you dont really listen to any more"" and it pays the songs I was just listening to and are a part of my playlists. I mean I guess it does act like a modern radio station by playing the same songs over and over again but I was expecting a more audio only endless discover playlist with some liked songs mixed in. 

finally. the ai voice model sucks. anything not english is horrible. And please for god sake stop recommending me red hot chilli peppers. it was funny when it played dani california in between motorhead and black sabath but i dont need a new chilli peppers song in every playlist and you cant mark stuff as dont reccomend. Also dont go to another playlist and then go back to the dj because it will play you the same songs over again","['[removed]', ""It played some good stuff I knew and then some good stuff I didn't... at first. The more I listened, the worse it got."", ""It does give some weird recommendations, but some brilliant ones as well. I've discovered and re-discovered some great indy music with it lately.\n\nI used it all day yesterday. At one point it went from playing UK Jazz to Death Metal. It knows me too well...\n\n...or so I thought. It then played Born in the 60s playlist. I was born in the 80s."", ""Yeah, the tool is not ready yet. I didn't like any music it threw at me besides the obvious. Then it may need to be updated more regularly since the same exact music played in the same day at different times. Not a good experience, I like the voice. Would be nice to hear facts about some tracks."", ""I have had a better experience this week with it. When I first tried it a few weeks ago it would only play things that were already in my main Playlist or randomly a bunch of modern country (which isn't similar to anything I listen to)"", 'It keeps giving me ""new era punk"" because it\'s apparently similar to what I listen to and I\'m just wondering where it even got that from, the closest thing I have to punk in my Playlists is The Offspring....\n\n\nIt was great the first time I used it, threw me some great songs, of course they were great, they were already on my Playlists....\n\nThe stuff it\'s thrown at me that isn\'t though? Christ, please give me a do not recommend button so I can train this damn thing\n\n\nMind, I haven\'t used it in a minute... Might give it a trial for the next few hours and see what happens\n\n\n\nEdit: so it\'s been 2 hours later and...\n\nIt played me 30 songs, 17 of which were already in my Playlists, 13 were not.\n\nTo break it down even further, 7 of the songs that weren\'t on my Playlists were apparently songs I\'ve had on repeat despite never hearing them before (lastFM confirms this with scrobble count) another 3 of the songs were by the same band, and only one song was added to my liked (honestly i\'d have do not recommend most of the others if it gave me the chance)\n\n\nOf the 17 it played that I already have saved, only one of them hadn\'t been listened to in the last couple of weeks....\n\nAll in all, it\'s still pretty crap, I have over 2k songs in my likes alone, come in Spotify there\'s a bigger pool to pull from than just songs I\'ve listened to this week!', 'Tons of random j-pop and Mexican rap.', ""Maybe this is their way of getting songs played from their new Discovery mode where they take 30% of a song's revenue and they'll show it to people?"", 'Yea it keeps playing pop music for some reason like ??? I listen to heavy metal and pop punk, not pop', 'I turned it off after 30 seconds. Hate the voice.', ""It played me three songs and then stopped and said something like, here's songs you haven't heard in awhile and played the exact same three songs again in the same order"", ""I don't use it never will"", 'It played the ace of the spades by motorhead like 6 times in a row. I do not like motorhead', 'I’ve been happy with it so far, it seems to be pretty inconsistent from person to person', 'It’s been hit or miss for me. I do find the concept interesting and hope it improves over time and they start letting you customize it or at least. Hangs the voice.', 'yeah… from soundgarden to “heres a summer hit you played a ton in the past… get ready to dance to ed helms” wtf', ""I liked DJ at first.  \nHowever,  I notice that I have 10 songs that play all the time and it's annoying."", 'Yep, it literally gave me group of songs reating to bagpipe electronica or somthing like that, no idea what propted that and hated every bit of it.', '""Here\'s a new artist really killing it in the metal genre"" \nProceeds to just play Metallica', ""I've not seen this feature. I'm premium 😕"", ""AI is only as good as the people behind it. Folsom Prison Blues by Johnny Cash has the word Blues in the title but it is a Country-Western song. Obviously, Spotify's coders know how to code but don't know dick about music."", 'I like it so far', 'mine somehow thinks the songs/picks i skip instantly are the ones i want the most. it hit the mark once and than never again.', 'It gave me a block of ""Songs from your past"" that were apparently things I listened to a lot in 2016 (along with a spiel about how wild of a year it was with the presidential election). I didn\'t join Spotify until 2017 and it was songs I\'ve never heard of.', 'For me it keeps playing things from 2016, except the problem is I don’t have any of the songs liked and I have to skip the whole queue.', 'I totally have the same issue with it predominantly playing music already in my playlists, and whilst I don\'t mind some of the recommendations, my biggest issue has been that as a change it decided to play a set of ""what\'s big in the uk right now"" but then started playing acts like dua lipa and selena gomez who i have never listened to and really aren\'t my jam. I have a wide and varied taste but i am predominantly into metal and alternative music and that chart music is mostly just noise to me. My biggest issue now though is that periodically it keeps trying to replay those songs by saying ""here\'s something you were listening to recently""...no i pressed the dj button to get out of it every time you tried and it only played because you freaking played it, not by any active choice I made, don\'t blame me.', 'I think this is me with johnny cash and chilli peppers. I have like 1 or 2 songs liked and it just kept throwing them at me. tried it again and it suddenly switched to weird pop songs and my chemical romance aka songs i dont listen to.', 'i’m a weezer fan with 30k+ streams and i probably get sublime who have come up on my radio in the past maybe 5 times all when i was out of the room more than i get weezer especially at first lol', 'Big weezer fan, ay?', 'Maybe you just listen to more Weezer than you think. It’s always giving me Drake, Frank Ocean, and Anderson Paak who are all three huge parts of my rotation.', ""Is this like when Pandora made every rock/alternative stream start and end at the Black Keys? I don't mind the Black Keys, one of my favorite bands, but just like Weezer I think they are friendly to a lot of different ears."", 'I can hear it saying that lmao', '[deleted]', ""Mine just started repeating the same songs it already recommended. I kinda' liked the concept at first, but wish it had more depth to it."", 'Dj said ""looks like metal is your thing"" then proceeds to play j-pop', 'it played me 2 songs from grease and then not a single song from a movie or tv show ever since', ""I also like to mix things up, but I've never listened to billboard 90s and it was like: hey here's some stuff you might like.\n\nI think the main problem is that it's scoring what we listened to and not just what we liked. So it'll pick some stuff that's a bit out of a person's range and then those songs get mixed into the algorithm. It's like a game of telephone—eventually you end up with nonsense.\n\nThey need to exclude AI recommended songs that weren't liked. Or at least weigh them much much less.""]"
Is DJ really an AI?,66,https://www.reddit.com/r/spotify/comments/13xm50d/is_dj_really_an_ai/,35,1685636907.0,"It honestly feels like they are just extracting songs from my playlists? I could listen to my own playlist and get the same result.

When I though Spotify was bringing an AI into the app I thought it would have been able to prompt it for specific requests. IDK if I'm missing something but I just feel like I could get the same out of my shuffle button... 🤷‍♂️","[""It doesn't seem like it. I kind of imagined there would be more interaction with the AI to make it more than just a selection of your most played songs..."", "">I could listen to my own playlist and get the same result.\n\nSeems that way to me too. If so, it's way overblown as a feature, imho."", 'It is. There’s the AI that powers the playlist generation/changes, and then the DJ voice itself.\n\nThe voice was created using Sonatic, a synthetic voice creation technology that uses AI to process a few hours worth of samples of someone’s voice, and then applies an algorithm to add intonation, inflection, and projection to create a voice model that sounds like a real person. GPT (the AI that powers ChatGPT) is then used to generate the descriptions/intros based on a scan of your taste profile characteristics and the music about to be played, and feeds that detail to the voice model to read/process.\n\nOtherwise, Spotify uses machine learning (ML) in its recommendation algorithm. They likely use a combo of AI and ML to automate creation of the different vibes/sets the DJ plays.', 'Idk it seemed cool to me at first but it seems to just be doing the sane songs again and again', 'consist obtainable sleep bike direful birds frightening cause aback money\n\n *This post was mass deleted and anonymized with [Redact](https://redact.dev)*', 'I have been very disappointed with DJ. It plays the same stuff over and over, just stealing from playlists I already have. Then it plays stuff I am completely uninterested in, such as country when I’m a metal rock fan and HATE country. It doesn’t seem to learn from me passing country 100% of the time. It says “ I see you like rock. Let me go a bit out of your boundary…” and plays the shite.', ""It's the best way to randomize your playlists. Shuffle has always been broken."", ""I'm loving the new DJ function. The only problem I'm having is that in all the documentation it says the DJ will give commentary between songs (which I want) but it only seems to give any input/speaking info when I press the DJ button and it switches to another song.  Anybody else experiencing the same?"", ""I don't know much about AI technology, but you guys definitely don't, ofcourse all the DJ's songs are going to be based on your playlists. It's looking at the type of music you listen to & how much you deviate. If you're just listening to the same playlists every time, then ofcourse it's going to just play those. Garbage in, garbage out. If you want to explore more music you actually have to put in the work to get the AI to recognize this expectation. Ofcourse it would be better to be able to directly give prompts to the DJ, this is just a more user friendly implementation of AI."", 'I think the AI related part comes from the natural-sounding script it generates. They cited that they are using OpenAI tech, which is GPT, which is a language model. It has nothing to do with the reccomendation algorithm.', 'Sort of unrelated but I\'ve been listening to a lot of music, particularly heavily instrumental based, that sounds like AI music. Like last time I was listening to orchestra cover songs but a lot of the music didn\'t sound pleasing to the ear. Today i searched saxophone and found ""cover bands"" with albums dating back to 2009.', 'It\'s just a ""Your Top Mix"" with a narrator, really dumb.', 'idc what y’all say; hearing this dudes voice in between sets is nice\nreally the only reason you’d want to use the feature', ""I'm still scratching my head why it played Do the Locomotion by Kylie Minogue!"", 'It literally would’ve taken 2 seconds to make it take some sort of input/prompt as to what music you want to listen to and then play it. A huge failure imo, call me dramatic but it literally serves nothing.', ""Don't know if real AI or fake, what I know is it is the most useless feature ever 🤣"", ""Yeah, I wish it played me songs that I've not listened to and that I might like. It's just basically my on repeats with a little from other playlists I've made."", ""It's a game changer. I love it. Bringing up tunes I had forgot about from 2017"", '[deleted]', 'Is anything ""really an AI"" at this stage. They\'re all basically just prediction engines that spit out a calculated likely result that the algorithm thinks you want.\n\nIt certainly isn\'t a music assistant and the end goal is to encourage you to listen to things that Spotify want you to listen to, when interjecting its own ""suggestions"".', ""Haven't used Spotify in months. Just got back into it and saw the AI and had the same thought. There should definitely be a way to talk to the AI to get requests for a specific type of song/a particular vibe."", 'The music selection algorithm has always been a machine learning model. The only thing different about the dj is that it also uses a speech synthesis program to talk in between the songs selected by that existing algorithm. Also, AI is a broad enough term to apply to pretty much any program so companies can just slap the term onto anything without technically lying bc everyone assumes they mean a neural net.', '>I just feel like I could get the same out of my shuffle button...\n\nTrue, but at least it shuffles the songs so that similar songs are played together, and throws in a few extras every now and then.', 'It has played me quite a few songs that ive never heard that were pretty good, but similar to stuff i like. It also just got a sick burn on me by saying “lemmy play some big songs from when you were younger!” And plays hank williams. I dont listen to country lol.', 'I like his voice, it’s soothing and sounds like a cool black guy.', 'There\'s a button that can give you ""different picks"" if you want it to take a different tangent. Seems to give a very different result to me if you\'re up for a change.', 'The in-depth commentary seems to be more rare, but ive heard it mention bands that are on tour, common songwriters on a set, album details ect\n\nedit.... it just gave a detailed intro to Arlo Parks including a mention of her Mercury Prize win', 'DJ only talks in-between sets of songs, each having a little theme, when you press the dj button it changes sets. its commentary isn’t anything special though like it says the same thing over and over lol', ""The intelligence is when it processes your text & then formats a response, ofcourse it's reasoning. It's also able to adjust responses based on past input. Do you even know what AI is?"", 'Tbh I had a long drive today and it seemed to get better with time... I do think there is great potential for an AI DJ which you can interact with verbally. I think I just got my hopes up too soon with this current one!', ""I hate his voice and his vocab... it's not my vibe"", 'He kind of reminds me of ice t, which im fine with.', 'I see what you did there…']"
"This is an (Incomplete) Guide to Indie. Looking for suggestions, crucial indie songs not listed, artists to consider. I trust this place more than any other AI DJ ",0,https://open.spotify.com/playlist/3U68qj6VyrZ0IoRS1YtbRU?si=9ec94b4bf2c24c2f,1,1736554793.0,,['[Snatch the Snail - Death and Taxes](https://open.spotify.com/track/6DgDxfnXHeNmFXZLOYiG10?si=JMHTntDZSkWfKTIKXy1xPg&context=spotify%3Aalbum%3A7K9uxXrKuCAKuStqteOHBT)']
