title,score,url,num_comments,created_utc,selftext,comments
What we need is a second AI DJ that plays new music you’ve never heard from various genres. Pls I’m begging y’all to make this.","['everynoise.com \n\nSearch this sub and /r/truespotify. Once you figure out how to use it, you will never run out of new music', 'Check if some of the artists you like have playlists on their profiles. Many will curate a list of songs that inspire them. These are gold mines.', ""I don't use daily mix / discover weekly. I use curated playlists / artists & song radio. It's better rabbit hole to me."", 'You’ve got to put the effort in yourself. If you keep listening to the same music, Spotify will keep recommending it. There are hundreds of other playlists on Spotify to listen to.', 'I use musicmap.com input an artist and it will suggest loads of great stuff', 'i used to use my discover weekly a lot and i found one of my favourite bands that way actually!\n\nedit; you can also remove the songs you don’t like from it and then next week spotify will show you less songs like that', 'If you’re into user created spotify playlists checkout https://playlost.fm.\n\nSubmit one of your favorite playlists and it’ll analyze the playlist and suggest similar user created playlists by matching shared artists, songs, and genres.\n\nIf you have checked this out stay tuned as I’m implementing some new features like a playlist aggregator for the suggested playlists.', 'Try Swipefy', 'I never listen to playlists.  I’m usually listening to albums.  When an album finishes, Spotify plays similar songs.  I’ve discovered artists that way.  Or sometimes I’ll go to an artist’s page, and at the bottom it’ll show similar artists, and discover artists that way.\n\nAnother way to find music, is to go on YouTube and find reviewers who review music similar from a genre you like.  I’ve discovered many artists that way, some people might make a lists of their favorite new albums, or rank albums or artists, top tens, etc.  Maybe they talk about an artist you’ve heard of but haven’t checked out, maybe watch the video for a recommendation.  We’re getting close to the end of the year, so album of the year lists will come soon.  I probably discover more artists on YouTube than Spotify.', 'Honestly some of the ways I’ve found bands I didn’t know is the “fans also like” section under bands I already know and it’s helped me find relatively well known bands and also unknown bands/ artists too.', 'What I like to do is pick a song by a band/artist I like that is the least similar to all of their other music and go to the radio for that song.', 'Going through the same thing now.\n\nFind a song you like and then ""Go To Song Radio"". From that new list, mine it for new artists and repeat until you have a new branch into a genre or artist you\'ve never heard before.', '- Sign up to Last.fm.\n- Follow some music mags like Pitchfork, The Quietus, and The Vinyl Factory. \n- Listen to independent radio stations like NTS or WFMU or FIP.\n- Use the amazing service Radiooooo. \n- Setup a WhatsApp with fellow music loving friends, ask everyone to invite a couple of other friends. Share what you find regularly.\n- Ditch Spotify for Qobuz or Tidal and get a Roon subscription.\n\nAlgorithms and AI can only advise you so far. Break out.', 'you can check out everynoise.com to scope different genres over Spotify or Forgotify to shuffle songs that have been played partially or never at all \n\nhttps://killthedj.com/how-to-find-new-music/', ""No, you need to stop relying on shitty algorithms and start compiling a playlist of music you're interested in listening to. Then, when you're in the mood, listen to some of it shuffled or in order. Save what you like and remove what you didn't."", 'I like Spotify, but after recent changes I feel like using YouTube music.', ""Go to an artist you like, scroll down to the bottom, and click the Similar Artists tab. If you've never heard of one, click it. Bam. Discovered a new artist."", 'Join discord servers for your favorite bands and see what everyone else is listening to', 'Use your daylist playlist.', 'I usually use [chosic.com](https://chosic.com) for discovering new music.', 'If you can’t find new music it’s a you problem (not trying to be mean). I personally find music and am pretty active on rateyourmusic but there are other sites that people have commented that also work. There’s so much great music out there to listen to you just gotta go find it.', ""Imo the most effective way to find new music is finding new music from aritsts you already listen to a lot. It's more likely you'll like new music from those artists than from some recommended new artist by an alogrithm.\n\nSpotify's Release Radar helps with that, except you need to make sure you follow every artist you like, else they won't show up in your Release Radar.\n\nThere's 3rd party apps like\xa0[Brew.fm](https://www.brew.fm/)\xa0(full disclaimer: I'm the maker) which can help you with that. Eg Brew makes auto playlists with new music from artists already in your playlists. There's other 3rd party Spotify apps too that eg send you daily emails."", 'I host a weekly trivia game at a restaurant/sport bar called Mr. Chubby\'s Wings. I use Spotify for the playlist used during the game. I called the playlist ""Chubby\'s"" and I empty it out each week for the following week\'s songs.\n\nWhen I empty the playlist and open it to search for songs to add, their idiotic algorithms suggest songs that have to do with erections and getting sexually excited.\n\nSpotify\'s search algorithms are useless.', 'https://linktr.ee/m.a.x.thebaroqueboy', ""There's this guy commenting right now who dabbles in playlist curation."", 'Here’s a playlist I waste a stupid amount of time updating.   Perhaps you’ll find it useful.  It’s always changing.  \nhttps://open.spotify.com/playlist/2qSnf5o94xPqrM2BDGaAze?si=NS2qZySfSBOLB6E_l9ZR5A', 'If you are interested in some new music, I have some to recommend: \n\nhttps://open.spotify.com/artist/2Z3OWQX3JP4J9Op7t4rbRD?si=358yG2SXSCKq9_KoeEodVw\n\nhttps://open.spotify.com/artist/2Z3OWQX3JP4J9Op7t4rbRD?si=358yG2SXSCKq9_KoeEodVw', 'Idk but theres this new feature that i suddenly had where i play my music of choice then there would be recommended songs based on what i was listenin to n its kinda accurate🍟', 'Go to the Fresh Finds playlists. It’s mostly new music with different genres and it’s updated every Thursday', ""Go to an album/playlist turn of shuffle and loop and play the last song skip towards the end and let radio/random shuffle do it's magic."", ""Or you could steal from YouTube channels that highlight new stuff. It's helped me a lot without much work."", 'I listen to a lot of different genres and subgenres so my daily mixes are pretty diverse', ""I religiously listen to New Music Friday. If a song isn't doing it for me I skip. If I really like a song I'll drop it in my regular rotation playlist. I've discovered a lot of new music this way."", ""You're doing it wrong"", 'What i really enjoy is finding a song that is in the mood i am in and spawning a radio off that. I tend to find other gems usually and may spawn more radio off that and get down some rabbit holes, musically that is', 'I search “picked just for you” , I do enjoy the interesting playlists spotify comes up with for me', 'Well lemme know if you want my suggestions. Can’t be worse than discover weekly, amirite?', ""A week or two ago I had a sort of fyp below my search bar, with # and a certain genre or style and quite detailed. Found some good so gs on there but it was removed after a week and I'm so pissed cause it brought me new songs I liked."", 'nDopee check out ww3', 'I browse Rate Your Music to find good bands and releases from genres I like.', 'Use the radio function if you like an album or song just go an play radio of that, you’ll find something you like and new', ""i read a few years ago that the algorithm for Discover Weekly is heavily influenced by what you add to playlists. it assumes that if you add a song to a playlist you must have really liked it. so i started a series of playlists i call Weekly Gold. i don't like super long playlists so i let them get to about 2.5 hours and start a new one. it helped a lot with getting more accurate suggestions.\n\nrecently i noticted i wasn't being suggested new music it was mostly stuff from the 2010s so i started adding in songs from my Release Radar to the same playlists and my Discover Weekly started to have some new suggestions."", ""I find so much good music on Spotify. What I do is I take an artist I like and find playlists that they are on. Most playlists aren't that great but some are really good. Like I found a 100 hour playlist the other day and I like most of the music on it so far.\n\nThen when I find a new artist I really like I start the process over. I've created about 200 hours of playlists of songs that I like just from exploring Spotify.\n\nSpotify radio is also pretty good."", 'They should call it MIDIFY the day lists are so mid', 'What!? ALL my new music comes from Spotify recs. Use r/musicrecommendations', 'If I find a song I like from someone I’ve never heard of, I’ll go to their page then scroll down and see the “fans also like” and scroll through those. I’ve found a wealth of great artists that way.', ""I'm over here still using Pandora"", 'https://youtu.be/eGlU-NXhmjs?si=_7WX3iv_mAFldcQ-\n\nMy buddy jordangates3k is on there, tell him to post safe haven w nickypea so I can get on there lol', 'I agree. All the mixes I get are songs on my playlists already. And the discover weekly always sucks ass.', 'I usually miss Spotify since switching to Apple, but it seems finding new music is easier. I keep adding to my library to improve suggestions and just ask for a random song. I’ve found a lot of good stuff but it’s Apple.', ""Tbh a good bit of the music I listen to now, I found just by letting Spotify do its thing after whatever album I'm currently obsessed with ends. Not to say that because it works for me it should work for you of course haha, just tossing my dissenting experience out there for the sake of it. This seems to work better for me than the parts of Spotify that are meant for finding new music, funny enough"", 'Also rateyourmusic.com/genres to see an explanation of genres and subgenres.', 'Oh wow I do really like everynoise.com they have a playlist with 1 song from every genre. How exciting. Thank you!', 'As a UI/UX Designer, ""once you figure out how to use it"" is such as mind boggling statement about something that should be so freaking easy. It\'s a music shuffler. How hard can it be to design?!', '>  artists & song radio\n\nThis is the key, found a band (Sticky Fingers) that over the course of the last few months have become one of my favourite bands doing this', ""Agreed. I have no trouble finding new stuff.\n\n&#x200B;\n\n\\- I listen to what I like when I am in the mood for it.\n\n\\- I use the niche mixes and try out new stuff.\n\n\\- I choose full albums, friend's mixes, artist mixes, radios for songs I like, artists I like, albums I like, etc..\n\n\\- I add and remove songs from my playlists.\n\n\\- I sample the albums that they show me every time I open the app.\n\n&#x200B;\n\n&#x200B;\n\nAt the end of the day, the new music is always there. You just have to listen to it. It might be more fun to pick some of it out on your own rather that expect a computer to do it all for you 100% of the time. All of this is said with the best of intentions by me. :-)"", 'This^^^^^^^!!!', 'Just googled it and it says there are 4 billion playlists. Billions!!', 'Not true. I follow hundreds and hundreds of artists. And still Spotify always put the same songs of the same artists in each daily mix.', 'I just discovered this a few days ago and even though I haven’t been able to use it much yet I’ve been super happy with the few I’ve found so far.', 'How do you remove songs from it?', 'everynoise is amazing. I have so many folders created by their site. [https://imgur.com/a/RaYCoxa](https://imgur.com/a/RaYCoxa)', 'I went through that playlist this year. Lots of fun. Made my algorithm pretty interesting lol', '..no it’s not', 'Yea going to song radio is the only way I really get to new stuff.', 'But are you listening to these hundreds and hundreds of different artists each week? If I listen to a wide range of different and new (to me) music one week, my Discover Weekly is more eclectic the following week and tends to show me artists I don’t know.', 'the same way you remove songs from any other playlist, like go in the menu or whatever and click like “remove” or something, it’s not too hard', ""But I don't want to go to my library and select one by one each artist. What's the purpose of daily mixes if they don't use the music I liked?\nLet's say I go to discover weekly and I follow 5 artists and I like 5 songs. Probably those 5 artists will never appear in the daily mixes."", ""Also, what's the point of discovery weekly if they put songs that were on your liked playlist on there""]"
Has anyone switched over or back from Apple Music?,11,https://www.reddit.com/r/spotify/comments/1l2ti0m/has_anyone_switched_over_or_back_from_apple_music/,21,1749001399.0,"If so why? 

Obviously if you’re in the Apple ecosystem it makes sense. 

I recently bought the AirPods Max and got a 3 month trial for Apple Music and wanted to experience hearing Dolby atmos/spatial audio and although yeah you can tell it’s more clear than Spotify but my main issue was that the audio was lower compared to Spotify the bass which I tend to like in my music wasn’t that great on Apple Music. 

My opinion is that Apple Music is for those who are deep into the Apple ecosystem and are absolutely wanting the best and clear audio in their music. 

However, that alone isn’t that big of a reason to make the switch. Maybe it’s due to me being with Spotify for for like 12 years. I’ve used it on Apple, Android and Microsoft devices with no issues. The Spotify UI is just better at recommending new music from my favorite artists or upcoming artist within my musical tastes. 

On Apple Music I felt lost. My playlist were all over the place compared to Spotify. Whereas Spotify felt more social with many playlists from users and its new AI DJ feature just makes it a better experience than just using a music app that feels soulless but hey at least the audio sounds a bit crisper lol ","['I want to love Apple Music so much because I pay for Apple one lol which I may cancel not sure yet. I used Apple Music off and on with Spotify for quite a while. Im back on Spotify because I have a better time with Spotifys playlist than I do with Apple \nMusics radio. Apple Music radio is actually atrocious. If I start a station from a country song there is no reason for 2pac to come on next. Which it does. Or Eminem. Or biggie. Lol I’m going to wait until iOS 19 to truly make a permanent switch but I like Spotify’s playlists. \n\nUnless you have equipment to take advantage of lossless, you’re probably not going to hear a difference. \n\nDolby atmos is hit or miss. Not worth it for me. Yet. \n\nAlso to comment on Apple Music audio being lower. It’s definitely not. I think you have “sound check” turned on it music settings.', 'I actually did the opposite. I switched from Apple Music TO Spotify.\n\nUsed Apple Music for a few years and I have actually used all main 3 music streaming services (Spotify, yt music and Apple Music) the reason I switched to Spotify is because Apple Music did not have a good algorithm in my case. There are only a few playlists that are made for you and they get updated weekly but have like 25 songs (unlike the many playlists on Spotify that are made for you automatically and have 50 songs each).\n\nAdditionally Apple Music removes your whole library if you unsubscribe unlike Spotify that keeps your playlists, library, songs, albums saved in their freemium model until you come back.\n\nI also like that you can preview playlists and albums on Spotify (scrolling through short snippets of every song) which helps me get an idea of wether the album is interesting enough to give it a full listen or not.\n\nI feel like Apple Music’s algorithm needs more improvement and a way to preview albums and playlists.\n\nEdit: more context', 'The library is better and I like that you can bring your own music that isn’t available in their library. I never use any of the social stuff.', 'I’ve switched back and fourth, Spotify feels more personal to me', 'I switched because I got the Apple one sub which includes Apple Music.', 'I switched from Apple Music to Spotify (and back and forth several times due to indecisiveness). I’ve decided to stick with Spotify though. The sound quality isn’t really that noticeable for my devices (I don’t have anything that can utilize Dolby Atmos). Spotify just has a better recommendation algorithm, and so so many QOL features that I’ve grown to love. For example how easy it is to add/drop music across multiple playlists by clicking the checkmark on the now playing screen. Or how your plays/streams count for the same song across different versions of an album (for example if I have a single version on my On Repeat and I switch to the album version, after a couple plays the On Repeat just simply swaps the versions out and I’m good to go. Apple Music resets play count when you do this because they actually track plays on individual devices which is an outdated way to handle it IMO). Also I just recently fell in love with the niche mixes, I didn’t even really know they existed because they are tucked away in the Made For You section but they are some of the best at generating what I want to hear', 'I have Apple Music with Apple One and I have Spotify. Apple Music is terrible at recommending music. Spotify’s algorithm is king. I also enjoy using Spotify on my Pixel and when I want to carry my iPhone, I can pick it up and resume in Spotify without skipping a beat. I like having my podcast, audiobooks and music in one app.', 'I switched from Apple Music a few months ago. I have rediscovered my old hobby of looking for new artists and how much I enjoy doing it. I feel Spotify is better for that.', 'I’ve been using Spotify since its inception and I personally loved Apple Music over Spotify. I use AirPod Pro 2, and although I’m not getting true lossless quality, I still notice a great difference in audio quality. It’s crisper, cleaner and has more depth, their playlists are built by actual people and don’t rely on A.I., and Apple Music looks better. Apple Music also has all the right features, at least for me. The ONLY reason I went back to Spotify is because Apple Music still has some growing to do, mainly with their organization. You can’t favorite artists with the same name, there’s other artists music tied up in other artists pages, and I’ve found multiple artists pages for the same artist because of either spelling or some glitch. It’s rather annoying. Once Apple Music buttons those things up, I’ll be going back for sure. But, for now I’ll settle for Spotify.', 'au tout début apple music était tres bon avec des propositions de playlists courtes mais ils ont tout changé et je trouve apple music....fade....deja les playlists ""energie"" et ""chill"" les 2 seuls qui vaillent sont bien, mais sans plus , la nouvelle radio decouverte est tres moyenne et n\'arrive pas a la cheville de ""decouvertes de la semaine"" a mon gout;...donc , c\'est bof, l\'application est tres stable , tres propre comme toujours chez apple....mais je prefere largement spotify avec ses ""decouvertes de la semaine"" ses ""niche mix"" et la ""daylist""', 'I came back to Spotify from Apple Music cause i missed using it a little bit and they offered me a 1 month subscription for $0 so i didnt have to pay for a whole month and im kind of digging the DJ X guy even though he can be a bit sassy if you skip the songs it suggests too much which is hilarious seeing him get mad when you skip songs but other than that its good to be back in the green circle gang. 🤣', ""I like the daily mixes enough to keep with Spotify. I also like having the podcasts in the same app. Apple music is great but it still feels like library storage. IDK if it changes recently but that's how it was a couple years ago."", 'Apple Music has a larger music selection, better audio quality, and works in the Apple ecosystem better. \n\nThere are many reasons to use it over Spotify. \n\nThe most important reason? Apple Music pays artists fairly.', 'Yes, was on Apple Music for 10 years, switched to Spotify for 2 months cause friends told me it was much better.. back on Apple Music. Also, I found out about an app called Marvis Pro, which makes Apple Music 3x better.. it really puts Apple WAYYY ahead of Spotify. It costs $10 but it’s soooooo worth it.', 'I keep coming back to Spotify… after trying all of the others. Maybe I just feel it’s the OG.', 'I turned off sound check and it still not as bassy as Spotify.', ""What they do is even more heinous, which is they keep all the songs you download with apple music in your library and they just don't work."", '^[Sokka-Haiku](https://www.reddit.com/r/SokkaHaikuBot/comments/15kyv9r/what_is_a_sokka_haiku/) ^by ^Lietenantdan:\n\n*I switched because I*\n\n*Got the Apple one sub which*\n\n*Includes Apple Music.*\n\n---\n^Remember ^that ^one ^time ^Sokka ^accidentally ^used ^an ^extra ^syllable ^in ^that ^Haiku ^Battle ^in ^Ba ^Sing ^Se? ^That ^was ^a ^Sokka ^Haiku ^and ^you ^just ^made ^one.', 'Yea Spotify seems to have more bass but Apple Music sounds richer.']"
