title,score,url,num_comments,created_utc,selftext,comments
The AI DJ would be a lot cooler if you could actually interact with it,21,https://www.reddit.com/r/spotify/comments/1cihozo/the_ai_dj_would_be_a_lot_cooler_if_you_could/,6,1714661671.0,"I like the idea behind the DJ, but instead of it being a glorified Smart
Shuffle it would be so much better if you could interact through voice or text.


Examples:

""Hey DJ, play me some kind of popular Hip Hop tracks from around 2004""

 ""I want to listen to some jazz but something with not a lot plays""

""Play me a mix of Country and Ska-Punk""

""Play set of songs from from x, x, and x artist""

""I feeling like watching world burn, play some metal songs with that vibe.""


These were just off the top of my head but being able to do any of that would be great","['I agree! Hope developers take note and consider adding this feature in future updates.', 'I like this. Really, I just need it to not exclusively replay the same music that\'s already in my ""Liked Songs"" list that constantly replay with the ""Shuffle"" anyway. If you could add a slider for percentage of favorites vs percentage of new music, that would be awesome. Being able to direct it to a particular combination of genres would be nice.', ""They need to add more DJ's, the current one just plays it way to safe and just plays your liked songs and genric top ten radio. What we need is a daylist DJ plays more underground bands."", 'I\'d love this feature.\n\nWhat I really want though is a way to tell my AI DJ that he\'s been picking absolute bangers the last few songs. Even just a thumbs up or something.\n\nBut, yes I agree. I\'d love to tell my DJ ""Hey, I\'m about to clean my house give me something upbeat"" or ""Hey DJ, I need something to study to"" and have him recommend songs.', 'You can kind of do this in a round about way. If you discuss with chat gpt what you want to hear and use it as your DJ it can give you a bulk txt list of songs and then you can copy and paste them into a playlist on the Spotify desktop version.\n\nI actually tried a fun prompt the other day ""based on all of our conversations and what you know about me guess my top 3 favorite songs"" then after we spoke about that for a while I said ""now that you know what I like and based on what you know about me from all of our conversations make me a playlist of songs you think I\'ll like but probably haven\'t heard before"" and of have me a great playlist that for the most part I hadn\'t heard before.', ""I think the inherent underlying problem is that Spotify actually wants to play you specific songs by specific artists to further their own interests. They don't want to make the ai dj  play you rare deep cuts\n\nAlso this is not that important, but I'd love to customize the voice.\n\nI got a vibe for you!""]"
Spotify Brings AI DJ to Spanish-Speaking Music Fans Around the World,1,https://newsroom.spotify.com/2024-07-17/spanish-ai-dj-livi-voice/,3,1721315934.0,,"[""While the new function is kinda cool overall, from time to time I can't find the 'Fuck, no, go back' button."", ""Bruh when is the rest of europe getting this? do they think we dont understand english? I don't wanna wait untill spotify gets to making a dumb voice for my country""]"
AI DJ is just a playlist,19,https://www.reddit.com/r/spotify/comments/1awzy8m/ai_dj_is_just_a_playlist/,8,1708584587.0,"AI DJ sounds like a great idea right? It would be amazing to just let it pick a series of songs for you based on your listening habits and let it learn from what you skip.  

But it's not like that. At all. It is just one long playlist that loops after about 60-70 songs. It's just a daily mix with an admittedly decent AI voice, but it doesn't do what it claims to do. It's no more than a daily mix.  

How Spotify thinks they can mislead people like this is beyond me. Couple this with the fact that a playlist with more than 60 songs doesn't shuffle in a way that makes sense, just feeding you the same songs over and over again is beyond frustrating.  

Spotify is quickly becoming ensh*tified. We need competitors in the market or we will keep getting subpar service that we PAY for.","[""yep it always loops round to top 100 list. not even my top 100 but the global or regional top 100. that also poisons my own music history and then it's negative feedback loop all the way down. \n\nmight fuck around and make a bot to permanently block everything in the top 100 from my listening even if it means sacrificing songs I actually like sometimes"", 'Most services today that purport to be AI, aren’t.\nWe’re definitely seeing tech progress in the space that is AI/ML but very few have figured out how to apply the nuts and bolts of the tech to offer anything novel and useful.\nBut, right now, a big software company like Spotify damn well has say (and show) they’re doing something with AI or the stockholders or board or other stakeholders will lose their shit.', "">We need competitors in the market or we will keep getting subpar service that we PAY for.\n\nDon't we already have competitors?\n\nApple Music\nDeezer\nYou Tube\nAmazon\nPandora \nTidal"", ""Don't worry, they'll fix it... *and then make you pay extra for it.*"", ""I can echo some of the same complaints about random choices or repetition, but I still love the DJ. So much so that I want it available for more of my listening.\n\nIs there a way to get the AI DJ to just present one of your Spotify Daily Mixes? If so, I can't find it. Supporting playback for every playlist or album seems untenable, but I feel like just the spotify generated Daily Mixes should be feasible."", ""Mine is no where near a global or regional top 100. I hear zero pop songs. Mostly songs I've heard before or played quite a bit of in the last five years."", ""yeah very limited discovery of songs that you'd like""]"
Typically I am anti ai; however Spotify’s new ai dj is amazing.,4,https://www.reddit.com/r/spotify/comments/17eyzua/typically_i_am_anti_ai_however_spotifys_new_ai_dj/,12,1698105299.0,"I’ve wanted Spotify to add personalized recommendations forever, now they have a system that learns which is awesome.","['i personally love the feature as well. it’s pretty much the only area AI should be allowed in for entertainment (recommendations and playlist curation).\n\nHowever, there seems to have been a recent change and now the DJ meshes songs together like an actual radio station. this is a problem for me as it cuts off like the first 30 seconds of a song, and similarly cuts off the last 30 seconds or more and blends it with the beginning of the next song. it’s driving me insane', '""Typically I am anti ai"" - yet you use Spotify, use Reddit and... let me guess... use Google... AI has been there for more than a decade ;) just saying that you\'re ""anti AI"" means that you don\'t really know how much you use it and depend on it.', 'In my opinion it’s a really forgettable feature. I like the concept, but I can’t find myself really using it all that much.. but that’s just a personal preference', 'I hate AI with a seething passion, but I really enjoy this feature as well. It’s introduced me to a couple of good tracks', ""I actually haven't tried it yet"", 'I\'ve been using pretty much every day, I like it in a lot of ways, I think the things it says and the way it pronounces certain things is funny, or when it changes the vibe to ""angry"" that makes me chuckle, how it pulls up old songs I forgot about, love that. Love how it\'s for the most part like my own personal radio station. \n\nMy biggest criticism is it seems to be really trying to shove this ""Front Left"" playlist down my throat, it goes back to it like every 5th set and it\'s making me side eye hard all the artists on the playlist, I skip it every time too, but it keeps trying, it makes me think it\'s an industry plant playlist, or a playlist the record labels have paid to push, it\'s starting to really frustrate me haha.', 'I haven’t experienced what you’re claiming at all. You need to check your cross fade setting.', 'and yes, DJ X is the best!', 'He plays a few songs way to often it gets on my nerves but he plays me new songs too and I love that', 'i have crossfade set to 0. this typically happens on songs with fade out outros, or songs with a quiet instrumental buildup before a drop. it essentially skips the intros and outros of songs', 'Nah, it absolutely does this sometimes.']"
AI DJ Xavier... only plays hip hop?,2,https://www.reddit.com/r/spotify/comments/1ajn6ng/ai_dj_xavier_only_plays_hip_hop/,7,1707156610.0,"Hey all,

Don't know if anyone has this issue...

I listen to a lot of hip hop (releases spanning the last 30 years) so I understand that it is already part of my algorithm. However I spend a lot of time listening to other things as well (mostly EDM). I've noticed that the AI will only play hip hop. I press the button to rebuild the playlist and consistently more hip hop. 

Also, I will play music from a playlist that is about 50/50 EDM and hip hop and it will only make recommendations for more hip hop never EDM... 

Why's Spotify pushing rap so hard? If it bases it's choices off of my musical selections over all time, I had a Brit-hop phase that lasted a solid year and it's not pushing any of that. Just new popular shit like Drake, Lil Baby, Da Baby, Kodak Black, Jack Harlow, DJ Khaled garbage, Uzi... fucking Yachty... How much are these motherfuckers paying Spotify?

Seems like the new alternative to advertisements is forcing garbage tunes in my ear.

&#x200B;

Thoughts?","[""I've noticed that it really takes into account what you been listening to for the past week or so specifically. \n\nAlso maybe you listen to more hiphop than you think. My wrapped was always hiphop dominated even though I thought of myself as a diverse listener, now I am actually more diverse and the DJ does an OK job. Rn playing too much jazz though cuz I been listening to jazz at work."", 'For me, it goes from nyc drill music to 80’s classic music. It’s weird', 'I am having a similar problem and it\'s getting old fast. Got here trying to find a solution...\n\nI listen to Metal. Hard Rock. Some EDM / House. Some random other things here and there. _Never_ rap or hip hop (unless Beastie Boys counts LOL).\n\nAbout every two to three hours, ""now some hip hop kicking off with Eminem!"" or all of a sudden it\'s dance grooves with all Spanish lyrics...', 'ring consist frame abundant grandiose jar profit aware innate straight\n\n *This post was mass deleted and anonymized with [Redact](https://redact.dev/home)*', ""Makes sense.. I'm going to experiment. Maybe leave a classic rock playlist on for a week and see what happens next week?"", 'I think it’s also possible that the algorithm prioritizes more popular artists and genres to some degree. I say this mostly cause I am someone who listens to a lot of different music, with a majority of it being extreme genres like metal or hardcore punk, but my algorithm still leans towards my more poppy genres like rap, alt rock, etc.']"
Why is shuffle still absolute garbage?,334,https://www.reddit.com/r/spotify/comments/1k4izqe/why_is_shuffle_still_absolute_garbage/,104,1745255998.0,"Seriously, it's been years now that we, the Spotify community, have been begging for a shuffle that does not play the same song over.and.over.and.over.and.over.again. The algorithm of ""we know how much you like this song, so we wan't you to hear it as often as possible!"" is literally the worst way to go about about shuffling songs.

I'm literally already so burntout and annoyed of hearing the same songs come up on shuffle in my Liked playlist that I don't... like them anymore :'( 

